{"borough_order":["Manhattan","Bronx","Queens","Brooklyn","Staten Island","EWR"],"gap_deg":1.5,"ring_rule":"docs/DATA_CONTRACTS.md (DR-1)","schema_version":"v1","tags":{"centroid":"DERIVED","ring":"DERIVED"},"zones":[{"LocationID":163,"borough":"Manhattan","lat":40.76442,"lon":-73.97757,"name":"Midtown North","ring_angle_deg":0.6673,"ring_index":0},{"LocationID":238,"borough":"Manhattan","lat":40.7917,"lon":-73.97305,"name":"Upper West Side North","ring_angle_deg":2.0019,"ring_index":1},{"LocationID":151,"borough":"Manhattan","lat":40.79796,"lon":-73.96817,"name":"Manhattan Valley","ring_angle_deg":3.3365,"ring_index":2},{"LocationID":24,"borough":"Manhattan","lat":40.80197,"lon":-73.96548,"name":"Bloomingdale","ring_angle_deg":4.6711,"ring_index":3},{"LocationID":166,"borough":"Manhattan","lat":40.80946,"lon":-73.96176,"name":"Morningside Heights","ring_angle_deg":6.0057,"ring_index":4},{"LocationID":152,"borough":"Manhattan","lat":40.81798,"lon":-73.95378,"name":"Manhattanville","ring_angle_deg":7.3403,"ring_index":5},{"LocationID":116,"borough":"Manhattan","lat":40.82701,"lon":-73.94852,"name":"Hamilton Heights","ring_angle_deg":8.6749,"ring_index":6},{"LocationID":244,"borough":"Manhattan","lat":40.84171,"lon":-73.9414,"name":"Washington Heights South","ring_angle_deg":10.0095,"ring_index":7},{"LocationID":243,"borough":"Manhattan","lat":40.85711,"lon":-73.93283,"name":"Washington Heights North","ring_angle_deg":11.3441,"ring_index":8},{"LocationID":128,"borough":"Manhattan","lat":40.87238,"lon":-73.92437,"name":"Inwood Hill Park","ring_angle_deg":12.6787,"ring_index":9},{"LocationID":120,"borough":"Manhattan","lat":40.84667,"lon":-73.93018,"name":"Highbridge Park","ring_angle_deg":14.0133,"ring_index":10},{"LocationID":127,"borough":"Manhattan","lat":40.86608,"lon":-73.91931,"name":"Inwood","ring_angle_deg":15.3479,"ring_index":11},{"LocationID":43,"borough":"Manhattan","lat":40.78248,"lon":-73.96555,"name":"Central Park","ring_angle_deg":16.6825,"ring_index":12},{"LocationID":153,"borough":"Manhattan","lat":40.87597,"lon":-73.91038,"name":"Marble Hill","ring_angle_deg":18.0171,"ring_index":13},{"LocationID":41,"borough":"Manhattan","lat":40.80433,"lon":-73.95129,"name":"Central Harlem","ring_angle_deg":19.3517,"ring_index":14},{"LocationID":42,"borough":"Manhattan","lat":40.81826,"lon":-73.94077,"name":"Central Harlem North","ring_angle_deg":20.6863,"ring_index":15},{"LocationID":74,"borough":"Manhattan","lat":40.80117,"lon":-73.93735,"name":"East Harlem North","ring_angle_deg":22.0209,"ring_index":16},{"LocationID":236,"borough":"Manhattan","lat":40.78044,"lon":-73.95701,"name":"Upper East Side North","ring_angle_deg":23.3555,"ring_index":17},{"LocationID":75,"borough":"Manhattan","lat":40.79001,"lon":-73.94575,"name":"East Harlem South","ring_angle_deg":24.6901,"ring_index":18},{"LocationID":263,"borough":"Manhattan","lat":40.77877,"lon":-73.95101,"name":"Yorkville West","ring_angle_deg":26.0247,"ring_index":19},{"LocationID":237,"borough":"Manhattan","lat":40.76862,"lon":-73.96563,"name":"Upper East Side South","ring_angle_deg":27.3593,"ring_index":20},{"LocationID":194,"borough":"Manhattan","lat":40.791,"lon":-73.9246,"name":"Randalls Island","ring_angle_deg":28.6939,"ring_index":21},{"LocationID":262,"borough":"Manhattan","lat":40.77593,"lon":-73.94651,"name":"Yorkville East","ring_angle_deg":30.0285,"ring_index":22},{"LocationID":141,"borough":"Manhattan","lat":40.76695,"lon":-73.95963,"name":"Lenox Hill West","ring_angle_deg":31.3631,"ring_index":23},{"LocationID":140,"borough":"Manhattan","lat":40.76548,"lon":-73.95474,"name":"Lenox Hill East","ring_angle_deg":32.6977,"ring_index":24},{"LocationID":202,"borough":"Manhattan","lat":40.7619,"lon":-73.94995,"name":"Roosevelt Island","ring_angle_deg":34.0323,"ring_index":25},{"LocationID":229,"borough":"Manhattan","lat":40.75673,"lon":-73.96515,"name":"Sutton Place/Turtle Bay North","ring_angle_deg":35.3669,"ring_index":26},{"LocationID":162,"borough":"Manhattan","lat":40.75669,"lon":-73.97236,"name":"Midtown East","ring_angle_deg":36.7015,"ring_index":27},{"LocationID":233,"borough":"Manhattan","lat":40.74991,"lon":-73.97044,"name":"UN/Turtle Bay South","ring_angle_deg":38.0361,"ring_index":28},{"LocationID":137,"borough":"Manhattan","lat":40.74044,"lon":-73.97649,"name":"Kips Bay","ring_angle_deg":39.3707,"ring_index":29},{"LocationID":224,"borough":"Manhattan","lat":40.73182,"lon":-73.9766,"name":"Stuy Town/Peter Cooper Village","ring_angle_deg":40.7053,"ring_index":30},{"LocationID":4,"borough":"Manhattan","lat":40.72375,"lon":-73.97697,"name":"Alphabet City","ring_angle_deg":42.0399,"ring_index":31},{"LocationID":161,"borough":"Manhattan","lat":40.75803,"lon":-73.9777,"name":"Midtown Center","ring_angle_deg":43.3745,"ring_index":32},{"LocationID":170,"borough":"Manhattan","lat":40.74775,"lon":-73.97849,"name":"Murray Hill","ring_angle_deg":44.7091,"ring_index":33},{"LocationID":232,"borough":"Manhattan","lat":40.71473,"lon":-73.98302,"name":"Two Bridges/Seward Park","ring_angle_deg":46.0437,"ring_index":34},{"LocationID":79,"borough":"Manhattan","lat":40.72762,"lon":-73.98594,"name":"East Village","ring_angle_deg":47.3783,"ring_index":35},{"LocationID":107,"borough":"Manhattan","lat":40.73682,"lon":-73.98405,"name":"Gramercy","ring_angle_deg":48.7129,"ring_index":36},{"LocationID":148,"borough":"Manhattan","lat":40.71894,"lon":-73.9909,"name":"Lower East Side","ring_angle_deg":50.0475,"ring_index":37},{"LocationID":45,"borough":"Manhattan","lat":40.71246,"lon":-73.99815,"name":"Chinatown","ring_angle_deg":51.3821,"ring_index":38},{"LocationID":144,"borough":"Manhattan","lat":40.72089,"lon":-73.99692,"name":"Little Italy/NoLiTa","ring_angle_deg":52.7167,"ring_index":39},{"LocationID":209,"borough":"Manhattan","lat":40.70907,"lon":-74.00366,"name":"Seaport","ring_angle_deg":54.0513,"ring_index":40},{"LocationID":87,"borough":"Manhattan","lat":40.70681,"lon":-74.0075,"name":"Financial District North","ring_angle_deg":55.3859,"ring_index":41},{"LocationID":105,"borough":"Manhattan","lat":40.68878,"lon":-74.01907,"name":"Governor's Island/Ellis Island/Liberty Island","ring_angle_deg":56.7205,"ring_index":42},{"LocationID":113,"borough":"Manhattan","lat":40.73258,"lon":-73.9943,"name":"Greenwich Village North","ring_angle_deg":58.0551,"ring_index":43},{"LocationID":88,"borough":"Manhattan","lat":40.70336,"lon":-74.01152,"name":"Financial District South","ring_angle_deg":59.3897,"ring_index":44},{"LocationID":164,"borough":"Manhattan","lat":40.74857,"lon":-73.98516,"name":"Midtown South","ring_angle_deg":60.7243,"ring_index":45},{"LocationID":114,"borough":"Manhattan","lat":40.72834,"lon":-73.99738,"name":"Greenwich Village South","ring_angle_deg":62.0589,"ring_index":46},{"LocationID":234,"borough":"Manhattan","lat":40.74034,"lon":-73.99046,"name":"Union Sq","ring_angle_deg":63.3935,"ring_index":47},{"LocationID":211,"borough":"Manhattan","lat":40.72389,"lon":-74.00154,"name":"SoHo","ring_angle_deg":64.7281,"ring_index":48},{"LocationID":12,"borough":"Manhattan","lat":40.70295,"lon":-74.01556,"name":"Battery Park","ring_angle_deg":66.0627,"ring_index":49},{"LocationID":261,"borough":"Manhattan","lat":40.70914,"lon":-74.01302,"name":"World Trade Center","ring_angle_deg":67.3973,"ring_index":50},{"LocationID":231,"borough":"Manhattan","lat":40.71777,"lon":-74.00788,"name":"TriBeCa/Civic Center","ring_angle_deg":68.7319,"ring_index":51},{"LocationID":13,"borough":"Manhattan","lat":40.71204,"lon":-74.01608,"name":"Battery Park City","ring_angle_deg":70.0665,"ring_index":52},{"LocationID":125,"borough":"Manhattan","lat":40.72629,"lon":-74.00749,"name":"Hudson Sq","ring_angle_deg":71.4011,"ring_index":53},{"LocationID":249,"borough":"Manhattan","lat":40.73458,"lon":-74.00287,"name":"West Village","ring_angle_deg":72.7357,"ring_index":54},{"LocationID":103,"borough":"Manhattan","lat":40.68986,"lon":-74.04529,"name":"Governor's Island/Ellis Island/Liberty Island","ring_angle_deg":74.0703,"ring_index":55},{"LocationID":104,"borough":"Manhattan","lat":40.69877,"lon":-74.04077,"name":"Governor's Island/Ellis Island/Liberty Island","ring_angle_deg":75.4049,"ring_index":56},{"LocationID":90,"borough":"Manhattan","lat":40.74228,"lon":-73.99697,"name":"Flatiron","ring_angle_deg":76.7395,"ring_index":57},{"LocationID":186,"borough":"Manhattan","lat":40.7485,"lon":-73.99244,"name":"Penn Station/Madison Sq West","ring_angle_deg":78.0741,"ring_index":58},{"LocationID":158,"borough":"Manhattan","lat":40.73504,"lon":-74.00898,"name":"Meatpacking/West Village West","ring_angle_deg":79.4087,"ring_index":59},{"LocationID":100,"borough":"Manhattan","lat":40.75351,"lon":-73.98879,"name":"Garment District","ring_angle_deg":80.7433,"ring_index":60},{"LocationID":68,"borough":"Manhattan","lat":40.74843,"lon":-73.99992,"name":"East Chelsea","ring_angle_deg":82.0779,"ring_index":61},{"LocationID":246,"borough":"Manhattan","lat":40.75331,"lon":-74.00402,"name":"West Chelsea/Hudson Yards","ring_angle_deg":83.4125,"ring_index":62},{"LocationID":230,"borough":"Manhattan","lat":40.75982,"lon":-73.9842,"name":"Times Sq/Theatre District","ring_angle_deg":84.7471,"ring_index":63},{"LocationID":48,"borough":"Manhattan","lat":40.76225,"lon":-73.98984,"name":"Clinton East","ring_angle_deg":86.0817,"ring_index":64},{"LocationID":50,"borough":"Manhattan","lat":40.76624,"lon":-73.99514,"name":"Clinton West","ring_angle_deg":87.4163,"ring_index":65},{"LocationID":143,"borough":"Manhattan","lat":40.77597,"lon":-73.98765,"name":"Lincoln Square West","ring_angle_deg":88.751,"ring_index":66},{"LocationID":142,"borough":"Manhattan","lat":40.77363,"lon":-73.98153,"name":"Lincoln Square East","ring_angle_deg":90.0856,"ring_index":67},{"LocationID":239,"borough":"Manhattan","lat":40.78396,"lon":-73.97863,"name":"Upper West Side South","ring_angle_deg":91.4202,"ring_index":68},{"LocationID":31,"borough":"Bronx","lat":40.85775,"lon":-73.87548,"name":"Bronx Park","ring_angle_deg":94.2548,"ring_index":69},{"